File Number,Project Type,Status,Filing Date,Project Name,APN,Street Address,City,State,ZIP,Latitude,Longitude,Address,Housing Type,Residential Units,Non-Residential Area,Hotel Rooms,Residential Care Units,Approval Date,Description,Plans,geometry,Planning Area,General Plan Designation,City Council District,Development Inspector,Utility Inspector,Water Service Provider,Transportation Area Zone,Special District Landscaping,Soil Type,School District Elementary,School District Secondary,Property Based Improvement District,Owl Overwintering Habitat,Natural Asbestos,HistoricArea,PovertyRate,Flood_Hazard_Area,Census Tract Languages,AirportNoise,Walk Score,Walk Score Description,Seismic Hazards,Road Noise,SNI Area,Name of Growth Area,Planning Project Manager,Public Works Engineer,Public Works File Number,Public Works Senior Engineer,Applicant Entity,Applicant Name,Representative Entity,Representative Name
PDA15-031-01,Industrial,Approved,9/1/20,Bloom Energy at Equinix,647-25-043,5 Great Oaks Blvd,San Jose,CA,95119,37.243051,-121.7841,5 Great Oaks Boulevard,,,92350,,,5/26/21,"Planned Development Permit Amendment to allow the construction of a 3-story, 57,000 - gross square foot Bloom Energy fuel cell structure to the east of the SV11 data center building approved under PD15-031 on a 11.4-gross acre site.",,POINT (6187888.363854758 1913533.755391459),Edenvale,Combined Industrial/Commercial,2,Carl Dinga,Greg Duffy,Great Oaks Water Company,667,"Raleigh, Coronado, Via Del Oro",Silt Loam,Oak Grove Elementary School District,East Side Union High School District,,,,,0.06,D,"English: 64%, Spanish: 18%, Other: 9%, Chinese: 6%, Vietnamese: 3%",,21,Car-Dependent,Liquefaction,,No,Old Edenvale,AWANG,Alex Wong,3-14681,Michelle Kimball,Bloom Energy,,,James Matthews
H20-024,Residential,Approved,7/15/20,Monterey Mixed Use,684-02-003,4300 Monterey Hwy,San Jose,CA,95111,37.273995,-121.830948,4300 Monterey Rd,MF,438,,,,,"SB 35 Ministerial Permit to allow mixed-use project with 3,035 square feet of retail and 438 affordable, residential units on a 2.29-gross acre site. ",,POINT (6174412.889566589 1924989.932033756),Edenvale,Combined Industrial/Commercial,2,Carl Dinga,Greg Duffy,San Jose Water Company,933,,Silt Loam,Oak Grove Elementary School District,East Side Union High School District,,,,,0.09,D,"English: 40%, Spanish: 37%, Vietnamese: 13%, Other: 8%, Chinese: 2%",,59,Somewhat Walkable,Liquefaction,,No,,RCUETOG,Khoder Baydoun,3-22047,Joe Provenzano,,Amanda Locke,,
CP18-022,Residential,Under Construction,6/26/18,Blossom Hill Affordable Apartments,690-25-021,397 Blossom Hill Rd,San Jose,CA,95123,37.251807,-121.827896,397 Blossom Hill Road,MF,147,,,,12/11/19,"A Conditional Use Permit to demolish an approximately 32,000 square foot building, remove six ordinance-sized trees and two non-ordinance sized trees, and to construct a 147-unit affordable housing building for seniors with approximately 16,000 square feet of ground floor commercial uses, site improvements, and a State Density Bonus request for reductions in motorcycle parking and private open space requirements, on an approximately 2.0-gross acre site.",http://csjpbce.sanjoseca.gov/ecmsviewer/713/165/45165713.pdf,POINT (6175186.21597613 1916899.420334165),Edenvale,Neighborhood/Community Commercial,2,Carl Dinga,Greg Duffy,Great Oaks Water Company,660,,Silt Loam,Oak Grove Elementary School District,East Side Union High School District,,,,,0.06,D,"English: 49%, Spanish: 23%, Other: 19%, Vietnamese: 5%, Chinese: 4%",,66,Somewhat Walkable,Liquefaction,"65-69 FWY, 75-79",No,Blossom Hill Rd/Snell Av,RCUETOG,Alex Wong,3-01412,Michelle Kimball,Blossom Hill LP,,,
PDA14-005-012,Industrial,Pending,11/4/21,PDA14-005-012 Western Digital,706-07-020,5601 Great Oaks Pkwy,San Jose,CA,95119,37.247759,-121.792849,5601 Great Oaks Pky Building 1,,,580000,,,,"Planned Development Permit Amendment to modify the previously approved PD Permit to allow the construction of one four-story, 200,000-square foot general office building, one four-story, 200,000-square foot R&D office/R&D building, one 3-story, 150,000-square foot R&D office/R&D building, one two-story, 30,000-square foot amenity building, one five-level separate parking structure and the associated site improvements on a 36.6-acre site.  ",,POINT (6185365.529853453 1915282.849155012),Edenvale,Industrial Park,2,Carl Dinga,Greg Duffy,Great Oaks Water Company,664,Hitachi,Silt Loam,Oak Grove Elementary School District,East Side Union High School District,,,,,0.05,D,"English: 56%, Spanish: 17%, Other: 17%, Chinese: 5%, Vietnamese: 5%",,28,Car-Dependent,Liquefaction,,No,,AWANG,Tiffany Pong,3-18761,Michelle Kimball,HGST INC,David Koury,KayVictor,Jason Victor 
PDA14-005-10,Industrial,Approved,5/3/18,Western Digital Great Oaks Campus,706-07-020,5601 Great Oaks Pkwy,San Jose,CA,95119,37.247759,-121.792849,5601 Great Oaks Parkway,,,73400,,,11/14/18,"Planned Development Permit Amendment to allow the construction of a two-story, 73,400-square foot industrial office building, up to 20% parking reduction, and site improvements including the removal of 10 parking spaces, modifications to pedestrian circulation, grading, stormwater management, accessible parking, lighting and landscape improvements on an approximately 2.45-acre portion of the 176-gross acre campus.",http://csjpbce.sanjoseca.gov/ecmsviewer/232/285/18285232.pdf,POINT (6185365.529853453 1915282.849155012),Edenvale,Industrial Park,2,Carl Dinga,Greg Duffy,Great Oaks Water Company,664,Hitachi,Silt Loam,Oak Grove Elementary School District,East Side Union High School District,,,,,0.05,D,"English: 56%, Spanish: 17%, Other: 17%, Chinese: 5%, Vietnamese: 5%",,28,Car-Dependent,Liquefaction,"75-79 FWY, 70-74, 65-69 FWY",No,,CVANDERZ,Arlyn Villanueva,3-18761,Samuel Yung,,David Koury,,
PD16-005,Residential,Under Construction,2/4/16,Istar/Great Oaks,706-08-008,6520 Gamma Wy,San Jose,CA,95119,37.240591,-121.789917,"West side of Great Oaks Blvd approx 1,000 feet northwesterly of Highway 85",MF,301,,,,5/18/16,Planned Development Permit to allow the removal of nine ordinance size trees and the construction of 301 multi-family residential units within two four-story buildings and two six-story parking structures on a 6.55 gross acre site.,http://csjpbce.sanjoseca.gov/ecmsviewer/311/745/15745311.pdf,POINT (6186182.902008511 1912661.43392102),Edenvale,Urban Residential,2,Carl Dinga,Greg Duffy,Great Oaks Water Company,667,"Raleigh, Coronado, Via Del Oro",Silt Loam,Oak Grove Elementary School District,East Side Union High School District,,,,,0.05,D,"English: 56%, Spanish: 17%, Other: 17%, Chinese: 5%, Vietnamese: 5%",,17,Car-Dependent,Liquefaction,"65-69 FWY, 75-79 FWY",No,Old Edenvale,RBUSTOS,Michelle Kimball,3-14681,Jeff Lee,"FWSH PARTNERS II, LLC",,,
PD12-039,Residential,Completed,10/11/12,South Village (Hitachi Condo's),706-65-020,5979 Raleigh Rd,San Jose,CA,95123,37.244894,-121.797554,0 Raleigh Road,MF,83,,,,12/20/12,"Planned Development Permit to allow development of 836 residences consisting of 103 single family detached residences, 347 single family attached residences, and 386 multi-family attached residences on 40.5 gross acre site.",http://csjpbce.sanjoseca.gov/ecmsviewer/317/143/13143317.pdf,POINT (6183981.700915087 1914258.74858205),Edenvale,Urban Village,2,Carl Dinga,Greg Duffy,Great Oaks Water Company,662,Hitachi,Silt Loam,Oak Grove Elementary School District,East Side Union High School District,,,,,0.05,D,"English: 56%, Spanish: 17%, Other: 17%, Chinese: 5%, Vietnamese: 5%",,47,Car-Dependent,"Liquefaction, No","65-69 FWY, No, 75-79 FWY, 65-69, 70-74",No,,JBATY,Norman Mascarinas,3-18634,,Lennar Homes of California,,,
SP20-012,Residential,Pending,4/15/20,VTA Blossom Hill Station TOD,486-41-033,525 Blossom Hill Rd,San Jose,CA,95123,37.251683,-121.835392,605 Blossom Hill Rd,MF,328,,,,,"Special Use Permit to allow the development of a Signature Project per Policy IP-5.10 of the San Jose General Plan, including the demolition of existing surface parking, the removal of 55 ordinance-size trees and 14 non-ordinance trees, and the construction of one six-story mixed use building with 13,590 square feet of commercial space and 239 market-rate multi-family residential units and one five-story multifamily residential building with 89 affordable housing units, with trail improvements to Canoas Creek
Additional policy review for Riparian Corridor and extended construction hours

This project is proposing 19% VLI units and qualifies for three incentives. They are requesting the following three incentives:
1. Reduction in private open space 
2. Reduction in the commercial square footage 
3. Allow for more affordable material alternatives such as stucco and cast trim pieces (Signature project requirement for high-quality materials)
",,POINT (6173004.02938993 1916885.319982996),Edenvale,Neighborhood/Community Commercial,2,Carl Dinga,Greg Duffy,San Jose Water Company,648,,Clay,Oak Grove Elementary School District,East Side Union High School District,,,,,0.1,D,"English: 60%, Spanish: 15%, Other: 14%, Vietnamese: 8%, Chinese: 3%",,72,Very Walkable,Liquefaction,,No,Blossom Hill Rd/Cahalan Av,LMEINERS,Tiffany Pong,3-16606,Michelle Kimball,Green Republic Blossom Hill LLC,,,Melissa Durkin
CP20-003,Industrial,Approved,10/11/18,231 Captiol Public Storage,462-19-013,231 W Capitol Expy,San Jose,CA,95136,37.276503,-121.843777,231 W. Capitol Expressway,,,179916,,,2/26/20,"Conditional Use Permit to allow the demolition of 34,457 square feet of existing ministorage buildings, the removal of six ordinance-size trees, and the construction of a new ministorage building totaling 179,616 square feet on an approximately 6.4-gross acre site.",,POINT (6170693.519628045 1925956.349744203),South,Combined Industrial/Commercial,2,Carl Dinga,Greg Duffy,San Jose Water Company,727,,Clay,Franklin-McKinley Elementary School District,East Side Union High School District,,,,,0.09,D,"English: 43%, Other: 23%, Vietnamese: 16%, Spanish: 14%, Chinese: 4%",,37,Car-Dependent,Liquefaction,65-69,No,,MFLORES1,,,,Public Storage,Mark Kennedy,"Bacinski & Associates, Inc.",Rose Bacinski 
H18-002,Commercial,Approved,1/9/18,Silver Creek Valley Rd Hotel,678-93-015,5952 Silver Creek Valley Rd,San Jose,CA,95138,37.258507,-121.784362,5952 Silver Creek Valley Road,,,73862,127,,5/1/19,"Site Development Permit to allow the development of a 4-story, 127-room hotel on a 2.18-gross acre vacant site in the CIC Combined Industrial/Commercial Zoning District.",http://csjpbce.sanjoseca.gov/ecmsviewer/603/746/18746603.pdf,POINT (6187889.335547154 1919161.841623436),Edenvale,Combined Industrial/Commercial,2,Carl Dinga,Greg Duffy,San Jose Municipal Water System,741,,Silt Loam,Oak Grove Elementary School District,East Side Union High School District,,Potential,,,0.04,D,"English: 46%, Other: 20%, Spanish: 16%, Vietnamese: 14%, Chinese: 4%",,25,Car-Dependent,Liquefaction,"65-69 FWY, 70-74",No,New Edenvale,RSHAH,Joe Provenzano,3-15404,Joe Provenzano,"K.D. Patel Buddy Silvercreek, LLC",,,
H18-016,Commercial,Approved,4/11/18,Piercy Hotel,678-93-040,469 Piercy Rd,San Jose,CA,95138,37.259262,-121.781282,469 Piercy Road,,,119333,175,,5/29/19,"Site Development Permit to allow the demolition of two existing structures approximately 4,800 square feet and 1,661 square feet, the construction of a 175-room Hotel with a public eating establishment, and the removal of five ordinance-size trees on an approximately 3.6-gross acre site.",http://csjpbce.sanjoseca.gov/ecmsviewer/921/743/18743921.pdf,POINT (6188789.390124309 1919424.426635356),Edenvale,Industrial Park,2,Carl Dinga,Greg Duffy,San Jose Municipal Water System,741,,Silt Loam,Oak Grove Elementary School District,East Side Union High School District,,,,,0.04,D,"English: 46%, Other: 20%, Spanish: 16%, Vietnamese: 14%, Chinese: 4%",,24,Car-Dependent,Liquefaction,No,No,New Edenvale,SFARMER,Alex Wong,3-15106,Michelle Kimball,Knowhere Holdings LLC,Bryan Robertson,,
H16-035,Industrial,Under Construction,9/27/16,Edenvale Self Storage Facility,678-93-005,5880 Hellyer Ave,San Jose,CA,95138,37.261402,-121.782328,5880 Hellyer Avenue,,,155550,,,5/3/17,"Site Development Permit to allow the removal of 39 ordinance sized trees for the construction of two, four-story self-storage facilities totaling 159,670 square feet in the LI Light Industrial Zoning District on 5.09 gross acre site",http://csjpbce.sanjoseca.gov/ecmsviewer/231/611/16611231.pdf,POINT (6188495.679596444 1920207.702528874),Edenvale,Light Industrial,2,Carl Dinga,Greg Duffy,San Jose Municipal Water System,739,,Clay Loam,Oak Grove Elementary School District,East Side Union High School District,,,,,0.04,D,"English: 46%, Other: 20%, Spanish: 16%, Vietnamese: 14%, Chinese: 4%",,23,Car-Dependent,"Liquefaction, Land_Slide",70-74,No,New Edenvale,LSIMVOUL,Joe Provenzano,3-18957,Vivian Tom,Dal Properties LLC,Mark Lazzarini ,,
SP20-013,Residential,Approved,4/16/20,Almaden Villas,259-41-070,747 Almaden Rd,San Jose,CA,95125,37.323079,-121.885159,1747 Almaden Rd,MF,62,,,,8/25/21,"Special Use Permit to allow the demolition of two commercial buildings, the removal of three ordinance-size trees, and the construction of a new five-story over podium multi-family residential building with 62 for-sale condominiums, including 11 affordable units, with associated parking, landscaping, and amenities.
Additional policy review for Parking Off-Site or Shared or Alternating

Density Bonus summary:
•	62 units total, 20% restricted for MI
•	15% Density Bonus applied
•	Standard Density Bonus parking ratios applied (1 space per one-bedroom, 1.5 spaces per two-bedroom, etc.)
•	Incentive 1: Increase Height from 45 feet to 65 feet
•	Incentive 2: Reduce Side Setback. The side setback in the R-M Zoning District is required to be increased one foot for each additional story above the second story, beyond the five-foot side setback as required per Section 20.30.200, reduced to five feet for the entire project.",,POINT (6158905.249178605 1943088.500753304),Central,Mixed Use Commercial,3,Pedro Colin,Greg Duffy,San Jose Water Company,581,,Silt Loam,San Jose Unified School District,San Jose Unified School District,,,,Guadalupe/Washington,0.14,AO,"Spanish: 65%, English: 25%, Other: 7%, Vietnamese: 2%, Chinese: 1%",60 CNEL,87,Very Walkable,Liquefaction,,,,LMEINERS,Steven Forster,3-25162,Joe Provenzano,,Sam Nemazie,Mayberry Workshop,Adam Mayberry 
PD20-003,Residential,Approved,5/6/20,Tamien Station TOD,434-13-041,1197 Lick Ave,San Jose,CA,95110,37.314246,-121.884923,1197 Lick Avenue,MF,569,,,,12/9/20,"Planned Development Permit to allow the demolition of a 11,400 square foot building and construction of a mixed-use development consisting of 569 residential units within three buildings, up to 3,000 square feet of child day care or commercial space and the removal of 64 Ordinance-sized trees and 58 non-Ordinance sized trees on an approximately 6.96-gross acre site.  Note: With resubmittal on 8/14/2020 and due to changing market conditions, the applicant has requested review of a second set of plans as a development alternative for 555 units (420 market rate + 135 affordable) in order to build more one bedroom units instead of studio units.",,POINT (6158926.273445814 1939871.712946094),Central,"Open Space, Parklands and Habitat",3,Pedro Colin,Greg Duffy,San Jose Water Company,584,,Silt Loam,San Jose Unified School District,San Jose Unified School District,,Potential,,,0.17,D,"Spanish: 66%, English: 23%, Vietnamese: 4%, Other: 4%, Chinese: 3%",,65,Somewhat Walkable,Liquefaction,,Washington,Tamien Station Area,JOESORDI,Tiffany Pong,3-11676,Samuel Yung,UrbanCo Tamien LLC,,"Republic Evergreen, LLC",Susan Mineta 
PD21-011,Residential,Pending,8/11/21,S. 1st Mixed Use,472-17-006,802 S First St,San Jose,CA,95110,37.323778,-121.88092,802 S. 1st,MF,246,,,,,"Planned Development Permit to allow the demolition of 31,152-square feet of commercial buildings on site and the construction of a mixed-use, mixed-income, multi-family housing project consisting of a six-story building with 246 residential units and 1,506-square feet of ground floor retail on a 1.2-gross acre site.",,POINT (6160141.485072357 1943324.76585337),Central,Transit Residential,3,Pedro Colin,Greg Duffy,San Jose Water Company,1164,,Silt Loam,San Jose Unified School District,San Jose Unified School District,,,,,0.24,D,"English: 39%, Spanish: 38%, Other: 12%, Vietnamese: 6%, Chinese: 5%",60 CNEL,92,Walker's Paradise,Liquefaction,,Spartan/Keyes,,RSHAH,Alex Wong,3-11948,Michelle Kimball,Maracor Development Inc.,Brad Dickason,The Schoennauer Co LLC,Erik Schoennauer
H17-019,Residential,Under Construction,4/25/17,Spartan Keyes Senior Housing,472-25-092,295 E Virginia St,San Jose,CA,95112,37.32694,-121.876039,295 E. Virginia Street,MF,301,,,,1/9/19,"Site Development Permit to allow the construction of a six-story below market rate senior housing with 301 studio units and to allow three concessions and waivers (building height, private and common open space, vehicle and motorcycle parking) on an approximate 1.72-gross acre site.",http://csjpbce.sanjoseca.gov/ecmsviewer/460/475/18475460.pdf,POINT (6161577.541157625 1944455.031475354),Central,Transit Residential,3,Pedro Colin,Greg Duffy,San Jose Water Company,1163,,Silt Loam,San Jose Unified School District,San Jose Unified School District,,,,,0.24,D,"English: 39%, Spanish: 38%, Other: 12%, Vietnamese: 6%, Chinese: 5%",,73,Very Walkable,Liquefaction,"60-64, 75-79 FWY",Spartan/Keyes,Martha Gardens,SFARMER,Brian Lee,3-01552,Samuel Yung,"AMG & Associates, LLC",,Alexis Gevorgian,
H21-002,Residential,Pending,1/29/21,551 Keyes Affordable Housing,447-12-057,551 Keyes St,San Jose,CA,95112,37.32579,-121.866335,551 Keyes St,MF,78,,,,,"SB 35 Ministerial Permit for the construction of a 100% affordable rental project consisting of a six story building with 78 residential units, 4,398 square feet of related service and office area, 69 parking spaces and the removal of 6 ordinance and 8 non-ordinance sized trees on a 0.65-gross acre site.",,POINT (6164392.705729761 1943995.017517216),Central,Urban Residential,3,Jose Alcazar,Greg Duffy,San Jose Water Company,1168,,Silt Loam,San Jose Unified School District,San Jose Unified School District,,,,,0.11,D,"English: 41%, Spanish: 37%, Vietnamese: 10%, Other: 7%, Chinese: 5%",,78,Very Walkable,Liquefaction,,,,JOESORDI,Tiffany Pong,3-25821,Samuel Yung,Charities Housing Development Corporation,Kathy Robinson,,
H21-014,Residential,Pending,4/9/21,East Alma Residences,477-05-005,Not Available,San Jose,CA,95112,37.322588,-121.863137,0 East Alma Ave,MF,88,,,,,Site Development Permit to allow up to 22 duplexes and 2 single family residences for a total of 44 units including 11 affordable units and the removal of 26 trees on an approximately 2.34-gross acre site. ,,POINT (6165305.505606775 1942815.722390513),Central,"Open Space, Parklands and Habitat",7,Pedro Colin,Greg Duffy,San Jose Water Company,1169,,Silt Loam,San Jose Unified School District,San Jose Unified School District,,,,,0.11,D,"English: 41%, Spanish: 37%, Vietnamese: 10%, Other: 7%, Chinese: 5%",,66,Somewhat Walkable,Liquefaction,,,,AATIENZA,Jason Yan,3-25845,Elizabeth Koki,"Affordable Housing Land Consultants, LLC",,,Amanda Locke
PDA14-035-01,Residential,Completed,8/21/14,Communication Hill (Phase 1),455-28-017,287 Adeline Pl #1,San Jose,CA,95136,37.28383,-121.85434,Junction of Communications Hill Blvd. and the CalTrain railway to the terminus of Communications Hill Blvd. and Casselino Drive.,SF,314,,,,3/18/15,"Site Development Permit Amendment to extend the validity of a Site Development Permit (File No. H06-027) that allowed the construction of approximately 2,140,000 square feet of commercial uses and parking structures for an additional three years, allow the demolition of portions of two existing parking structures, the construction of a six-story parking structure, the removal of 104 existing trees, and the installation of solar panels at an existing shopping center (Westfield Valley Fair) on a 71 acre site.",http://csjpbce.sanjoseca.gov/ecmsviewer/737/465/13465737.pdf,POINT (6167659.024956703 1928668.154631732),South,Mixed Use Neighborhood,7,Carl Dinga,Greg Duffy,San Jose Water Company,557,Communication Hill,Clay Loam,Franklin-McKinley Elementary School District,East Side Union High School District,,,TRUE,,0.05,D,"English: 56%, Spanish: 14%, Other: 13%, Vietnamese: 9%, Chinese: 8%",,20,Car-Dependent,,,,,,,,,KB Home So Bay Inc,Peter Lezak,,
PDA14-035-06,Residential,Pending,4/2/19,Comm Hill Phase 3,455-28-017,Not Available,San Jose,CA,95136,37.286953,-121.859078,0 Curtner Avenue,MF,798,,,,,Planned Development Permit Amendment to allow for the development of Phases 3 and 4 of the Communications Hill project to construct 798 single-family detached and attached residences on an approximately 140.1 gross acre site.,,POINT (6166297.24478321 1929825.110639633),South,Urban Residential,7,Carl Dinga,Greg Duffy,San Jose Water Company,724,,Clay Loam,Franklin-McKinley Elementary School District,East Side Union High School District,,,TRUE,,0.05,D,"English: 56%, Spanish: 14%, Other: 13%, Vietnamese: 9%, Chinese: 8%",,5,Car-Dependent,Land_Slide,"70-74, 65-69 FWY, 75-79 FWY",No,,LMEINERS,Tiffany Pong,3-18407,Michelle Kimball,KB Home So Bay Inc,Peter Lezak,,
PDA14-035-05,Residential,Pending,4/10/17,Communication Hill Village Center,455-28-017,Not Available,San Jose,CA,95136,37.286953,-121.859078,junction of Communications Hill Blvd. and the CalTrain railway to the terminus of Communications Hill Blvd. and Casselino Drive.,MF,490,,,,,"Planned Development Permit Amendment to construct 505 residential units, 32,873 square feet of commercial space and 16,215 square feet of amenity space on 8.4 gross acre site.",,POINT (6166297.24478321 1929825.110639633),South,Urban Residential,7,Carl Dinga,Greg Duffy,San Jose Water Company,724,,Clay Loam,Franklin-McKinley Elementary School District,East Side Union High School District,,,TRUE,,0.05,D,"English: 56%, Spanish: 14%, Other: 13%, Vietnamese: 9%, Chinese: 8%",,5,Car-Dependent,Land_Slide,"70-74, 65-69 FWY, 75-79 FWY",No,,LMEINERS,Tiffany Pong,3-18407,Michelle Kimball,KB Home So Bay Inc,Peter Lezak,,
PD14-035,Commercial,Approved,3/15/13,Communications Hill,455-09-040,3075 Empoli St,San Jose,CA,95136,37.285163,-121.857772,On the hills from the junction of Communications Hill Blvd. and the CalTrain railway to the terminus of Communications Hill Blvd. and Casselino Drive.,,,68000,,,11/21/14,"Approve a master street and lot layout and to allow and removal of 52 trees of various size and species for future development of up to 2,200 residential units, up to 67,500 square feet of retail/commercial space, up to 1.44 million square feet of industrial park uses, parks, trails, a school site",http://csjpbce.sanjoseca.gov/ecmsviewer/692/783/14783692.pdf,POINT (6166667.691162275 1929167.920241549),South,Industrial Park,7,Carl Dinga,Greg Duffy,San Jose Water Company,724,,Clay Loam,Franklin-McKinley Elementary School District,East Side Union High School District,,,TRUE,,0.05,D,"English: 56%, Spanish: 14%, Other: 13%, Vietnamese: 9%, Chinese: 8%",,16,Car-Dependent,Land_Slide,"70-74, 65-69 FWY, 75-79 FWY",No,,MDAVIS,Allen Baquilar,3-18407,Norman Mascarinas,KB Home So Bay Inc,,,
PDA14-035-04,Residential,Under Construction,4/9/17,Communication Hill Phase II,455-28-016,202 Agustin Narvaez St,San Jose,CA,95136,37.285098,-121.852037,junction of Communications Hill Blvd. and the CalTrain railway to the terminus of Communications Hill Blvd. and Casselino Drive.,MF,486,,,,7/26/17,"Planned Development Permit Amendment to allow a reduction in the number of units for Phase 2 of the Communications Hill Planned Development from 648 units to 486 units, replacement of four podium buildings (322 units) with 16 ten-plex buildings (160 units), and modifications in grading, retaining walls, and landscaping to accommodate the new dwelling types on a 125-gross acre site.",http://csjpbce.sanjoseca.gov/ecmsviewer/952/113/17113952.pdf,POINT (6168335.642008428 1929120.101153557),South,Mixed Use Neighborhood,7,Carl Dinga,Greg Duffy,San Jose Water Company,557,Communication Hill,Clay Loam,Franklin-McKinley Elementary School District,East Side Union High School District,,,TRUE,,0.05,D,"English: 56%, Spanish: 14%, Other: 13%, Vietnamese: 9%, Chinese: 8%",,23,Car-Dependent,Land_Slide,"70-74, 65-69 FWY, 75-79 FWY",No,,NTHOMAS,Arlyn Villanueva,3-18407,Norman Mascarinas,KB Home So Bay Inc,,,
H17-058,Industrial,Completed,11/2/17,970 McLaughlin Industrial,472-10-109,970 Mclaughlin Ave,San Jose,CA,95122,37.335201,-121.854383,970 Mclaughlin Avenue,,,223717,,,3/13/19,"Site Development Permit to allow the demolition of eight commercial buildings totaling 139,123 square feet, removal of 37 ordinance size trees, and construction of a 223,727-square foot warehouse distribution center on a 10.69-gross acre site.",http://csjpbce.sanjoseca.gov/ecmsviewer/107/698/18698107.pdf,POINT (6167917.199961112 1947370.721376599),Central,Industrial Park,7,Jose Alcazar,Greg Duffy,San Jose Water Company,552,,Silt Loam,Franklin-McKinley Elementary School District,East Side Union High School District,,,,,0.19,D,"Spanish: 60%, Vietnamese: 19%, English: 11%, Other: 5%, Chinese: 5%",,79,Very Walkable,Liquefaction,"75-79 FWY, 70-74, 65-69 FWY",No,,PKELLY,Michelle Kimball,3-24066,Jeff Lee,,Robert Guerena,,
